review_id,brand,brand_alias,aspect,sentiment,text
kenangan_1083,Kopi Kenangan,National Brand,taste,positive,Tempat ternyaman buat belajar hihi . Tempat buat nongkrong . Kopinya juga enak semuaaa
kenangan_1084,Kopi Kenangan,National Brand,taste,negative,Sudah berkali kali pesan disini selalu ga enak. Padahal di cabang yg lain enak enak aja.. Pesan less sugar masih kemanisan. Pesan less ice masih banyak es. Asli ga ngerti lagi sama kopken bubat. Tolong diperbaiki!
kenangan_1085,Kopi Kenangan,National Brand,service,negative,Pelayan cewe nya gak sopan dan berkata kasar..... Kami juga beli bukan minta... Tolang kasih teguran buat karyawan cewe itu gak sopan....
kenangan_1086,Kopi Kenangan,National Brand,ambiance,positive,"Cozy.. minus satu aja ga ada stop kontak di area smoking, jd ga bisa buka laptop sambil udud"
kenangan_1087,Kopi Kenangan,National Brand,ambiance,positive,"Pelayanan nya ramah, pembuatan minuman nya juga tidak menunggu terlalu lama, rasa minumannya enak, tapi ya standar kaya yg lain aja. Tempat nya enak buat nongkrong, recommended."
kenangan_1087,Kopi Kenangan,National Brand,service,positive,"Pelayanan nya ramah, pembuatan minuman nya juga tidak menunggu terlalu lama, rasa minumannya enak, tapi ya standar kaya yg lain aja. Tempat nya enak buat nongkrong, recommended."
kenangan_1087,Kopi Kenangan,National Brand,taste,positive,"Pelayanan nya ramah, pembuatan minuman nya juga tidak menunggu terlalu lama, rasa minumannya enak, tapi ya standar kaya yg lain aja. Tempat nya enak buat nongkrong, recommended."
kenangan_1088,Kopi Kenangan,National Brand,ambiance,positive,"Rekomendasi buat nugas dan nyantai daerah buah batu, tempatnya lumayan ramai dan untuk rasa tidak usah diragukan enakkk"
kenangan_1088,Kopi Kenangan,National Brand,taste,positive,"Rekomendasi buat nugas dan nyantai daerah buah batu, tempatnya lumayan ramai dan untuk rasa tidak usah diragukan enakkk"
kenangan_1090,Kopi Kenangan,National Brand,service,negative,Lama banget pesenan nya padahal. Cuma 1 rugi waktu bagi ojol
kenangan_1091,Kopi Kenangan,National Brand,ambiance,positive,tempat ngopi ternyaman
kenangan_1093,Kopi Kenangan,National Brand,service,negative,"Kopi Langganan Ku, SYG bbrp kali Masalahnya : Kurangnya Hormat, Sopan, Tutur Kata Pegawainya terutama Kasir Perempuan. Semoga ada Evaluasi TKS"
kenangan_1093,Kopi Kenangan,National Brand,taste,negative,"Kopi Langganan Ku, SYG bbrp kali Masalahnya : Kurangnya Hormat, Sopan, Tutur Kata Pegawainya terutama Kasir Perempuan. Semoga ada Evaluasi TKS"
kenangan_1098,Kopi Kenangan,National Brand,service,negative,"Halo kopken Cibaduyut, saya dapat layanan yang tidak begitu baik hari ini, saya berniat mau pesan, tapi karena yang jaga 1 orang doang, dan dia lagi siapin minuman orang lain saya tungguin, saya panggil lagi, katanya bentar ya kak, tapi dia masih sibuk dengan meracik minuman lain, saya paham banyak pesanan saat itu, saya sudah cukup menunggu lumayan lama untuk sekedar ""dilayani"" mau minum apa saat di kasir, tapi kakaknya tetep ga menghampiri saya. Setidaknya pesanan saya ditampung dulu, saya gapapa nunggu minuman agak lama, tapi ini mau pesan aja lamak kaliii"
kenangan_1098,Kopi Kenangan,National Brand,taste,negative,"Halo kopken Cibaduyut, saya dapat layanan yang tidak begitu baik hari ini, saya berniat mau pesan, tapi karena yang jaga 1 orang doang, dan dia lagi siapin minuman orang lain saya tungguin, saya panggil lagi, katanya bentar ya kak, tapi dia masih sibuk dengan meracik minuman lain, saya paham banyak pesanan saat itu, saya sudah cukup menunggu lumayan lama untuk sekedar ""dilayani"" mau minum apa saat di kasir, tapi kakaknya tetep ga menghampiri saya. Setidaknya pesanan saya ditampung dulu, saya gapapa nunggu minuman agak lama, tapi ini mau pesan aja lamak kaliii"
kenangan_1099,Kopi Kenangan,National Brand,ambiance,positive,"Kalau mau duduk-duduk ke Lantai 2 nya enak,, nyaman,, tenang... Soalnya kalau di lantai bawah rame antrian bapak² ojol..."
kenangan_1099,Kopi Kenangan,National Brand,service,positive,"Kalau mau duduk-duduk ke Lantai 2 nya enak,, nyaman,, tenang... Soalnya kalau di lantai bawah rame antrian bapak² ojol..."
kenangan_1099,Kopi Kenangan,National Brand,taste,positive,"Kalau mau duduk-duduk ke Lantai 2 nya enak,, nyaman,, tenang... Soalnya kalau di lantai bawah rame antrian bapak² ojol..."
kenangan_1100,Kopi Kenangan,National Brand,ambiance,positive,minum tempat parkir aja. pelayanan super ramah
kenangan_1100,Kopi Kenangan,National Brand,service,positive,minum tempat parkir aja. pelayanan super ramah
kenangan_1101,Kopi Kenangan,National Brand,ambiance,positive,"Tempat ngopi yang ada smoking areanya di balkon, cocok juga untuk kerjaa, cuma gak ada wifinya aja sih, siap2 kuota ajaa.."
kenangan_1102,Kopi Kenangan,National Brand,ambiance,positive,Cukup nyaman tempatnya... Sayang parkiran terbatas..
kenangan_1103,Kopi Kenangan,National Brand,ambiance,positive,"Setiap x mampir bentaran buat beresin deadline online disini anehnya selalu dlm keadaan bersih. Minimalis, tdk berisik. Parkir agak sempit hny untuk kendaraan roda 2, roda 4 bs parkir di KFC sebelahnya aja. Fav : Kenangan Mantan & Thai Tea is the best for me anw"
kenangan_1104,Kopi Kenangan,National Brand,service,positive,Barista inisial F cantik banget deh
kenangan_1105,Kopi Kenangan,National Brand,taste,positive,"Untuk racikan minuman disini enaknya stabil! Cuman boba nya yg kurang stabil tp gapapa wajar, pesen susu boba gula aren selalu gamau pake boba, pertama nyoba lagi pake boba ya disini dan lagi kedapetan boba yg enak ga liat!! Goodjob! Pokonya ini jadi salahsatu cabang kedai kopi kenangan yg aku pilih buat ngopi walo deket rumah ada wkwk"
kenangan_1106,Kopi Kenangan,National Brand,ambiance,positive,"Pelayanan memuaskan, tempat nya juga bersih & luas, ada 2 lantai. Lantai atas cocok bila digunakan untuk work from anywhere. Kopi nya enak, penyajiannya juga cepat."
kenangan_1106,Kopi Kenangan,National Brand,service,positive,"Pelayanan memuaskan, tempat nya juga bersih & luas, ada 2 lantai. Lantai atas cocok bila digunakan untuk work from anywhere. Kopi nya enak, penyajiannya juga cepat."
kenangan_1106,Kopi Kenangan,National Brand,taste,positive,"Pelayanan memuaskan, tempat nya juga bersih & luas, ada 2 lantai. Lantai atas cocok bila digunakan untuk work from anywhere. Kopi nya enak, penyajiannya juga cepat."
kenangan_1108,Kopi Kenangan,National Brand,service,positive,"gapernah bosen ke store ini,kopi juga rasanya konsisten,plus barista nya two thumbs up deh pada ramah dan baik"
kenangan_1108,Kopi Kenangan,National Brand,taste,positive,"gapernah bosen ke store ini,kopi juga rasanya konsisten,plus barista nya two thumbs up deh pada ramah dan baik"
kenangan_1109,Kopi Kenangan,National Brand,ambiance,positive,"Salah satu cabang terbaik di kota bandung, menu nya lengkap dan minumannya enak enak, barista nya ramah banget. Colokan banyak, toilet dan mushola juga ada, rekomend banget buat nongkrong kumpul kumpul atau ngerjain tugas karna ada wifi juga."
kenangan_1109,Kopi Kenangan,National Brand,service,positive,"Salah satu cabang terbaik di kota bandung, menu nya lengkap dan minumannya enak enak, barista nya ramah banget. Colokan banyak, toilet dan mushola juga ada, rekomend banget buat nongkrong kumpul kumpul atau ngerjain tugas karna ada wifi juga."
kenangan_1109,Kopi Kenangan,National Brand,taste,positive,"Salah satu cabang terbaik di kota bandung, menu nya lengkap dan minumannya enak enak, barista nya ramah banget. Colokan banyak, toilet dan mushola juga ada, rekomend banget buat nongkrong kumpul kumpul atau ngerjain tugas karna ada wifi juga."
kenangan_1110,Kopi Kenangan,National Brand,ambiance,positive,"tempat nya enak dan nyaman sekali untuk menugas dan mengobrol santai. tempat nya sangat luas juga ada 2 lantai. barista nya ramah ramah,dan karna udah sering kesana jadi barista nya udah tau mau pesen apa. tapi,apa wajib membayar parkir? baru banget dapet kejadian yg bikin jadi tempat ini kurang nyaman karna ada tukang parkir yang ga ramah dan ga sopan. di minta tiap keluar 2000 rupiah, pernah di kasih 1000 rupiah ga terima dan malah di lempar gitu aja. jujur tempatnya enak dan nyaman banget,tapi karna ada juru parkir yang ga sopan jadi males kesana lagi. SARAN AJA KALO SEMISAL BEBAS PARKIR,MOHON UNTUK DI KASIH TULISAN BEBAS PARKIR BIAR TIDAK ADA PUNGLI."
kenangan_1110,Kopi Kenangan,National Brand,service,positive,"tempat nya enak dan nyaman sekali untuk menugas dan mengobrol santai. tempat nya sangat luas juga ada 2 lantai. barista nya ramah ramah,dan karna udah sering kesana jadi barista nya udah tau mau pesen apa. tapi,apa wajib membayar parkir? baru banget dapet kejadian yg bikin jadi tempat ini kurang nyaman karna ada tukang parkir yang ga ramah dan ga sopan. di minta tiap keluar 2000 rupiah, pernah di kasih 1000 rupiah ga terima dan malah di lempar gitu aja. jujur tempatnya enak dan nyaman banget,tapi karna ada juru parkir yang ga sopan jadi males kesana lagi. SARAN AJA KALO SEMISAL BEBAS PARKIR,MOHON UNTUK DI KASIH TULISAN BEBAS PARKIR BIAR TIDAK ADA PUNGLI."
kenangan_1110,Kopi Kenangan,National Brand,taste,positive,"tempat nya enak dan nyaman sekali untuk menugas dan mengobrol santai. tempat nya sangat luas juga ada 2 lantai. barista nya ramah ramah,dan karna udah sering kesana jadi barista nya udah tau mau pesen apa. tapi,apa wajib membayar parkir? baru banget dapet kejadian yg bikin jadi tempat ini kurang nyaman karna ada tukang parkir yang ga ramah dan ga sopan. di minta tiap keluar 2000 rupiah, pernah di kasih 1000 rupiah ga terima dan malah di lempar gitu aja. jujur tempatnya enak dan nyaman banget,tapi karna ada juru parkir yang ga sopan jadi males kesana lagi. SARAN AJA KALO SEMISAL BEBAS PARKIR,MOHON UNTUK DI KASIH TULISAN BEBAS PARKIR BIAR TIDAK ADA PUNGLI."
kenangan_1111,Kopi Kenangan,National Brand,service,negative,Pelayanan sangat lelet ngabisin waktu doang
kenangan_1112,Kopi Kenangan,National Brand,ambiance,positive,"Tempat nya nyaman nyaman, bersih, kopi nya enak. Tempat terbaik buat nongki"
kenangan_1112,Kopi Kenangan,National Brand,taste,positive,"Tempat nya nyaman nyaman, bersih, kopi nya enak. Tempat terbaik buat nongki"
kenangan_1114,Kopi Kenangan,National Brand,ambiance,positive,Tukang parkir depan gerai dijaga bapak² yang ngotot dan gak sopan. Parkir agak lama aja protes. Katanya setoran karang tarunanya tekor kalau parkir agak lama. Udah suka males-malesan nyeberangin kendaraan. Jujur aja: makanan sama minuman di sini enak kok. Baristanya juga ramah². Tempatnya bersih. Wifi kenceng. Tempat nyaman. Cuma tukang parkirnya bikin gamau balik lagi sini. Malesin.
kenangan_1114,Kopi Kenangan,National Brand,service,positive,Tukang parkir depan gerai dijaga bapak² yang ngotot dan gak sopan. Parkir agak lama aja protes. Katanya setoran karang tarunanya tekor kalau parkir agak lama. Udah suka males-malesan nyeberangin kendaraan. Jujur aja: makanan sama minuman di sini enak kok. Baristanya juga ramah². Tempatnya bersih. Wifi kenceng. Tempat nyaman. Cuma tukang parkirnya bikin gamau balik lagi sini. Malesin.
kenangan_1114,Kopi Kenangan,National Brand,taste,positive,Tukang parkir depan gerai dijaga bapak² yang ngotot dan gak sopan. Parkir agak lama aja protes. Katanya setoran karang tarunanya tekor kalau parkir agak lama. Udah suka males-malesan nyeberangin kendaraan. Jujur aja: makanan sama minuman di sini enak kok. Baristanya juga ramah². Tempatnya bersih. Wifi kenceng. Tempat nyaman. Cuma tukang parkirnya bikin gamau balik lagi sini. Malesin.
kenangan_1115,Kopi Kenangan,National Brand,taste,positive,Enak dipake nugas sendirian atau bareng kelompok
kenangan_1116,Kopi Kenangan,National Brand,ambiance,positive,TEMPATNYA ENAKEUN BUAT NUGAS DI INDOOR LANTAI 2 NYA UDAH ADA FREE WIFINYA JUGA
kenangan_1117,Kopi Kenangan,National Brand,taste,negative,Sy membeli via gofood tp bgt sampe rmh semua ga sesuai dgn yg tertera di aplikasi...di aplkiasi jumbo di ksh regular...di aplikasi minta ice di ksh hot...ga dibaca atw gmn ya...sy kecewa..ga mau beli lg kopi kenangan yg di cibaduyut
kenangan_1118,Kopi Kenangan,National Brand,taste,positive,Always a perfect Oat Milk Latte.
kenangan_1123,Kopi Kenangan,National Brand,taste,positive,Yummy
kenangan_1124,Kopi Kenangan,National Brand,taste,positive,"Kopi nya enak dan mantap rasanya ,rotinya jg enak ,ada minuman selain kopi"
kenangan_1125,Kopi Kenangan,National Brand,ambiance,positive,"Salah satu tempat favorit buat ngopi ma ngadem...waktu yg cocok buat ngadem sih biasanya dbawah jam 12 siang...klo jam 12 kesana biasanya tambah rame apalagi hari minggu penuh... Menu fav d kopi kenangan manta / latte /matcha seri outside Ngomong2 saya baru ngeh...sekarang ada ""bel""... klo misal mo manggil staff buat pesen atau ngambil pesenan bs tekan bel nya Nyobain croissant almond nya...enak..renyah... Donat'a teksturnya aga kering...tp gula taburnya manis'a pas..."
kenangan_1125,Kopi Kenangan,National Brand,service,positive,"Salah satu tempat favorit buat ngopi ma ngadem...waktu yg cocok buat ngadem sih biasanya dbawah jam 12 siang...klo jam 12 kesana biasanya tambah rame apalagi hari minggu penuh... Menu fav d kopi kenangan manta / latte /matcha seri outside Ngomong2 saya baru ngeh...sekarang ada ""bel""... klo misal mo manggil staff buat pesen atau ngambil pesenan bs tekan bel nya Nyobain croissant almond nya...enak..renyah... Donat'a teksturnya aga kering...tp gula taburnya manis'a pas..."
kenangan_1125,Kopi Kenangan,National Brand,taste,positive,"Salah satu tempat favorit buat ngopi ma ngadem...waktu yg cocok buat ngadem sih biasanya dbawah jam 12 siang...klo jam 12 kesana biasanya tambah rame apalagi hari minggu penuh... Menu fav d kopi kenangan manta / latte /matcha seri outside Ngomong2 saya baru ngeh...sekarang ada ""bel""... klo misal mo manggil staff buat pesen atau ngambil pesenan bs tekan bel nya Nyobain croissant almond nya...enak..renyah... Donat'a teksturnya aga kering...tp gula taburnya manis'a pas..."
kenangan_1126,Kopi Kenangan,National Brand,ambiance,positive,Kopi dijam 11.00 wah enak menikmati suasana bandung
kenangan_1126,Kopi Kenangan,National Brand,taste,positive,Kopi dijam 11.00 wah enak menikmati suasana bandung
kenangan_1127,Kopi Kenangan,National Brand,ambiance,positive,Terletak di area outdoor Yogya Grand Kepatihan.. pelayanan lumayan lama..banyak kursi di depan outlet kopi kenangan..
kenangan_1127,Kopi Kenangan,National Brand,service,positive,Terletak di area outdoor Yogya Grand Kepatihan.. pelayanan lumayan lama..banyak kursi di depan outlet kopi kenangan..
kenangan_1127,Kopi Kenangan,National Brand,taste,positive,Terletak di area outdoor Yogya Grand Kepatihan.. pelayanan lumayan lama..banyak kursi di depan outlet kopi kenangan..
kenangan_1128,Kopi Kenangan,National Brand,service,positive,"Yg jaga cuma 1 tapi gercep banget. Tetep ramah meskipun beli kopi promoan, rasa dan porsi tetap sama seperti biasa, tersedia banyak meja dan kursi untuk bersantai. Oke banget deh pelayanannya di sini"
kenangan_1128,Kopi Kenangan,National Brand,taste,positive,"Yg jaga cuma 1 tapi gercep banget. Tetep ramah meskipun beli kopi promoan, rasa dan porsi tetap sama seperti biasa, tersedia banyak meja dan kursi untuk bersantai. Oke banget deh pelayanannya di sini"
kenangan_1129,Kopi Kenangan,National Brand,ambiance,positive,"tempat luas, parkir aman, helm aman, makanan enak"
kenangan_1129,Kopi Kenangan,National Brand,taste,positive,"tempat luas, parkir aman, helm aman, makanan enak"
kenangan_1130,Kopi Kenangan,National Brand,packaging,negative,"Pertama kali nyobain kopi kenangan. Pick up langsung distore kepatihan, setelah pesan di aplikasi. Pesan 3 kopi, semua request dipisah es batunya. Tercengang bangeeet dirumah,ketika dibuka ngeliat es batu ditempati hanya pakai plastik kresek. Menyedihkan.. semacam beli dipinggir jalan. Not recomended deeh."
kenangan_1130,Kopi Kenangan,National Brand,taste,negative,"Pertama kali nyobain kopi kenangan. Pick up langsung distore kepatihan, setelah pesan di aplikasi. Pesan 3 kopi, semua request dipisah es batunya. Tercengang bangeeet dirumah,ketika dibuka ngeliat es batu ditempati hanya pakai plastik kresek. Menyedihkan.. semacam beli dipinggir jalan. Not recomended deeh."
kenangan_1131,Kopi Kenangan,National Brand,ambiance,positive,sebetulnya untuk yg tempat main sepatu roda. Tolong di tingkatkan karyawan nya cuma satu sepaturoda banyak yg harus diperbaiki
kenangan_1132,Kopi Kenangan,National Brand,packaging,positive,"Awalnya sy bukan pecinta kopi.. Paling suka nyruput dr suami seteguk.. Pas nyobain kopi kenangan mantan yg pake gula aren, duaar.. Knp sy jd addict dgn kopi2 bgini.. My lord!!! Meski ada sensasi pait2ny, tp ga bisa brenti nyeruput... 1 cup itu krn saking lekohnya, bs jd 2 cup krn sy suka racik lagi drumah dtmbah susu full cream.. Dan rasanya smkin endolita"
kenangan_1132,Kopi Kenangan,National Brand,taste,positive,"Awalnya sy bukan pecinta kopi.. Paling suka nyruput dr suami seteguk.. Pas nyobain kopi kenangan mantan yg pake gula aren, duaar.. Knp sy jd addict dgn kopi2 bgini.. My lord!!! Meski ada sensasi pait2ny, tp ga bisa brenti nyeruput... 1 cup itu krn saking lekohnya, bs jd 2 cup krn sy suka racik lagi drumah dtmbah susu full cream.. Dan rasanya smkin endolita"
kenangan_1133,Kopi Kenangan,National Brand,taste,positive,"Kopi kenangan mantan yang pernah ada, rasanya bikin deg degan dan Cukup dahsyat..."
kenangan_1134,Kopi Kenangan,National Brand,service,negative,"nge kasir sendiri, trus bkin kopinya sndiri, gaada barista nya, gila sih sbel bgt nunggunya lama"
kenangan_1135,Kopi Kenangan,National Brand,service,negative,"Di aplikasi sudah di klik pesan sudah jadi, pas saya mau pick up bilang nunggu di panggil, selang 20 menit mereka ngobrol"" sesama barista sampai pesanan saya tdk di buat"" . Saya komplain langsung ternyata pesanan saya belum di buat sama mereka . Barista cewe dan cowo pake kaca mata . Kejadian senin 9 desember jam 20.00"
kenangan_1136,Kopi Kenangan,National Brand,service,negative,Prosesnya lama banget....sampai kesel nungguin
kenangan_1137,Kopi Kenangan,National Brand,service,negative,"Yg namanya hari weekend itu pasti rame, tolong lah kepada owner jangan sampe pelayanan hanya 1 orang."
kenangan_1138,Kopi Kenangan,National Brand,service,positive,"Tempatnya bersih, pelayanannya ramah & cepat"
kenangan_1139,Kopi Kenangan,National Brand,ambiance,positive,"Tempatnya di jalan Buahbatu terlihat jelas saat jalanan lengang atau macet, tempatnya tidak ramai luas dan banyak tempat duduk. Tersedia juga smoking area"
kenangan_1140,Kopi Kenangan,National Brand,ambiance,positive,"Sering sekali kesini tempatnya nyaman menurut saya untuk berlama-lama juga, trus pelayannya juga baik baik"
kenangan_1140,Kopi Kenangan,National Brand,service,positive,"Sering sekali kesini tempatnya nyaman menurut saya untuk berlama-lama juga, trus pelayannya juga baik baik"
kenangan_1141,Kopi Kenangan,National Brand,ambiance,positive,"Tempatnya nyaman, luas, terutama hidangan kopi yang stabil & juara. Kurang Wi-Fi aja"
kenangan_1141,Kopi Kenangan,National Brand,taste,positive,"Tempatnya nyaman, luas, terutama hidangan kopi yang stabil & juara. Kurang Wi-Fi aja"
kenangan_1142,Kopi Kenangan,National Brand,service,positive,"Nice,ramah,playan cepat good Bobanya enak"
kenangan_1142,Kopi Kenangan,National Brand,taste,positive,"Nice,ramah,playan cepat good Bobanya enak"
kenangan_1144,Kopi Kenangan,National Brand,ambiance,positive,rekomendasi tempat ngopi
kenangan_1146,Kopi Kenangan,National Brand,taste,positive,"Paling favorit tetap creamy aren latte, rasanya juara."
kenangan_1147,Kopi Kenangan,National Brand,ambiance,positive,Tempatnya nyaman.dan bersih
kenangan_1148,Kopi Kenangan,National Brand,ambiance,positive,Bagus tempatnya nyaman mudah di akses buat nongkrong bareng teman juga ok
kenangan_1149,Kopi Kenangan,National Brand,ambiance,positive,"Bagus, namun sayang ga ada mushola nya Tempat nya udh enak buat ngopi"
kenangan_1149,Kopi Kenangan,National Brand,taste,positive,"Bagus, namun sayang ga ada mushola nya Tempat nya udh enak buat ngopi"
kenangan_1150,Kopi Kenangan,National Brand,service,positive,"Pelayanannya bagus ramah dan gercep, terlebih layanan terhadap komplenannya sangat gercep dan langsung diganti, the bestt"
kenangan_1151,Kopi Kenangan,National Brand,price,negative,"Rasanya sih oke, tapi jangan coba2 minta tambah gula karena dikenakan tambahan biaya 6.000"
kenangan_1151,Kopi Kenangan,National Brand,taste,negative,"Rasanya sih oke, tapi jangan coba2 minta tambah gula karena dikenakan tambahan biaya 6.000"
kenangan_1152,Kopi Kenangan,National Brand,taste,positive,Bagi pecinta kopi pake gula.mampirlah sini. Ada sofa enak buat nongkrong.
kenangan_1153,Kopi Kenangan,National Brand,taste,positive,Enak sekali kopinya cocok tempatnya untuk sekedar nongkrong atau sambil ngerjain tugas
kenangan_1154,Kopi Kenangan,National Brand,ambiance,positive,Kopi kenangan rasa kopi dan suasana tempatnya paling ok enak dan nyaman dibanding pesaing sekelasnya ✨
kenangan_1154,Kopi Kenangan,National Brand,taste,positive,Kopi kenangan rasa kopi dan suasana tempatnya paling ok enak dan nyaman dibanding pesaing sekelasnya ✨
kenangan_1155,Kopi Kenangan,National Brand,ambiance,positive,"Pelayanan cepet, ramah, parkir cukup luas, klo gak kebagian parkir mobil bisa parkir di Griya juga."
kenangan_1155,Kopi Kenangan,National Brand,service,positive,"Pelayanan cepet, ramah, parkir cukup luas, klo gak kebagian parkir mobil bisa parkir di Griya juga."
kenangan_1156,Kopi Kenangan,National Brand,ambiance,positive,Tempatnya nyaman luas.. Pilihan minumannya jg banyak dan enak..
kenangan_1156,Kopi Kenangan,National Brand,taste,positive,Tempatnya nyaman luas.. Pilihan minumannya jg banyak dan enak..
kenangan_1159,Kopi Kenangan,National Brand,service,positive,"Pelayanan ramah , enak cuman 1 pintu nya ngebuat tangan saya kejepit"
kenangan_1159,Kopi Kenangan,National Brand,taste,positive,"Pelayanan ramah , enak cuman 1 pintu nya ngebuat tangan saya kejepit"
kenangan_1161,Kopi Kenangan,National Brand,ambiance,positive,Tempat nongkrong dan enak buat diskusi. Harga murah di hari Rabu (karena diskon)
kenangan_1161,Kopi Kenangan,National Brand,price,positive,Tempat nongkrong dan enak buat diskusi. Harga murah di hari Rabu (karena diskon)
kenangan_1161,Kopi Kenangan,National Brand,taste,positive,Tempat nongkrong dan enak buat diskusi. Harga murah di hari Rabu (karena diskon)
kenangan_1164,Kopi Kenangan,National Brand,ambiance,positive,"Suasana nyaman, kopi nya juara, pelayanan mempesonaaaa..."
kenangan_1164,Kopi Kenangan,National Brand,service,positive,"Suasana nyaman, kopi nya juara, pelayanan mempesonaaaa..."
kenangan_1164,Kopi Kenangan,National Brand,taste,positive,"Suasana nyaman, kopi nya juara, pelayanan mempesonaaaa..."
kenangan_1165,Kopi Kenangan,National Brand,service,positive,Semoga lebih ditingkatkan lagi untuk pengecekan saat customer order melalui aplikasi online
kenangan_1166,Kopi Kenangan,National Brand,ambiance,positive,Tempatnya nyaman utk istirahat dan menikmati kopi enak.
kenangan_1166,Kopi Kenangan,National Brand,taste,positive,Tempatnya nyaman utk istirahat dan menikmati kopi enak.
kenangan_1167,Kopi Kenangan,National Brand,ambiance,positive,"Sebenernya enak tempatnya untuk ngopi, tapi sayang tempat tidak terlalu kelihatan, karena di pojok"
kenangan_1167,Kopi Kenangan,National Brand,taste,positive,"Sebenernya enak tempatnya untuk ngopi, tapi sayang tempat tidak terlalu kelihatan, karena di pojok"
kenangan_1169,Kopi Kenangan,National Brand,ambiance,positive,"Tempat nyaman, pelayanan oke, tapi gak ada mushola"
kenangan_1169,Kopi Kenangan,National Brand,service,positive,"Tempat nyaman, pelayanan oke, tapi gak ada mushola"
kenangan_1170,Kopi Kenangan,National Brand,ambiance,positive,"Maantapp ,nyaman buat nongkrong tempat nya bersih karywan nya ramah"
kenangan_1170,Kopi Kenangan,National Brand,service,positive,"Maantapp ,nyaman buat nongkrong tempat nya bersih karywan nya ramah"
kenangan_1171,Kopi Kenangan,National Brand,ambiance,positive,"Lokasi strategis, tempat parkir untung2an. 2 lantai, smooking area di lantai 2"
kenangan_1174,Kopi Kenangan,National Brand,service,negative,"Pelayanan lama, pekerja terlalu santai, pintu rusak juga gak di perbaiki."
kenangan_1176,Kopi Kenangan,National Brand,ambiance,positive,"Kopi nya pasti enak , tempat luas buat nongkrong"
kenangan_1176,Kopi Kenangan,National Brand,taste,positive,"Kopi nya pasti enak , tempat luas buat nongkrong"
kenangan_1178,Kopi Kenangan,National Brand,ambiance,positive,Tempat lumayan enak buat ketemuan sama teman
kenangan_1178,Kopi Kenangan,National Brand,taste,positive,Tempat lumayan enak buat ketemuan sama teman
kenangan_1179,Kopi Kenangan,National Brand,taste,positive,"Kopinya enak, harus nyoba dine in sih nanti"
kenangan_1180,Kopi Kenangan,National Brand,service,positive,"baristanya ramah, minumannya enak dan tempatnya cocok buat nongkrong atau juga wfc"
kenangan_1180,Kopi Kenangan,National Brand,taste,positive,"baristanya ramah, minumannya enak dan tempatnya cocok buat nongkrong atau juga wfc"
kenangan_1181,Kopi Kenangan,National Brand,ambiance,negative,"Kopi kenangan terburuk yg pernah d temui Pegawai nya sangat tengik ,,antri lebih awal bisa lebih dulu yg baru pesan sangat tengik pegawai nya Antrian tidak jelas dan pelayanan sangat buruk ,,, Sangat tidak recommended mending beli d tempat yg lain"
kenangan_1181,Kopi Kenangan,National Brand,service,negative,"Kopi kenangan terburuk yg pernah d temui Pegawai nya sangat tengik ,,antri lebih awal bisa lebih dulu yg baru pesan sangat tengik pegawai nya Antrian tidak jelas dan pelayanan sangat buruk ,,, Sangat tidak recommended mending beli d tempat yg lain"
kenangan_1181,Kopi Kenangan,National Brand,taste,negative,"Kopi kenangan terburuk yg pernah d temui Pegawai nya sangat tengik ,,antri lebih awal bisa lebih dulu yg baru pesan sangat tengik pegawai nya Antrian tidak jelas dan pelayanan sangat buruk ,,, Sangat tidak recommended mending beli d tempat yg lain"
